{
  "id": "darden-restaurants",
  "name": "Darden Restaurants, Inc.",
  "reviewedAt": "2026-10-17",
  "identityEvidenceUrls": [
    "https://www.nasdaqtrader.com/dynamic/SymDir/otherlisted.txt",
    "https://www.darden.com/"
  ],
  "websiteUrl": "https://www.darden.com/",
  "securities": [
    {
      "market": "US",
      "symbol": "DRI",
      "exchange": "NYSE",
      "kind": "common",
      "evidenceUrls": [
        "https://www.nasdaqtrader.com/dynamic/SymDir/otherlisted.txt",
        "https://www.darden.com/"
      ]
    }
  ],
  "logos": [
    {
      "url": "https://financialmodelingprep.com/image-stock/DRI.png",
      "source": "fmp-public-image",
      "status": "verified",
      "checkedAt": "2026-10-17",
      "referenceUrl": "https://www.darden.com/",
      "redistribution": "not-granted",
      "sha256": "2ec6ebc3c9ef94474687aa0c1f803febd299ab16d016e6bc83d114b18652d9c2",
      "width": 100,
      "height": 100,
      "format": "png",
      "notes": "Black/red curved D device compared with the official corporate header and favicon."
    }
  ]
}
