{
  "id": "dow",
  "name": "Dow Inc.",
  "reviewedAt": "2026-10-17",
  "identityEvidenceUrls": [
    "https://www.nasdaqtrader.com/dynamic/SymDir/otherlisted.txt",
    "https://corporate.dow.com/en-us.html"
  ],
  "websiteUrl": "https://corporate.dow.com/en-us.html",
  "securities": [
    {
      "market": "US",
      "symbol": "DOW",
      "exchange": "NYSE",
      "kind": "common",
      "evidenceUrls": [
        "https://www.nasdaqtrader.com/dynamic/SymDir/otherlisted.txt",
        "https://corporate.dow.com/en-us.html"
      ]
    }
  ],
  "logos": [
    {
      "url": "https://financialmodelingprep.com/image-stock/DOW.png",
      "source": "fmp-public-image",
      "status": "verified",
      "checkedAt": "2026-10-17",
      "referenceUrl": "https://corporate.dow.com/en-us.html",
      "redistribution": "not-granted",
      "sha256": "f7f64f1558a2422ed9dfbab92986b6c48f055c05cacbc7cb3b0cebf65030de1f",
      "width": 250,
      "height": 250,
      "format": "png",
      "notes": "Red Dow diamond compared with the official corporate header and touch icon."
    }
  ]
}
