{
  "id": "emcor-group",
  "name": "EMCOR Group, Inc.",
  "reviewedAt": "2026-10-17",
  "identityEvidenceUrls": [
    "https://www.nasdaqtrader.com/dynamic/SymDir/otherlisted.txt",
    "https://www.emcorgroup.com/"
  ],
  "websiteUrl": "https://www.emcorgroup.com/",
  "securities": [
    {
      "market": "US",
      "symbol": "EME",
      "exchange": "NYSE",
      "kind": "common",
      "evidenceUrls": [
        "https://www.nasdaqtrader.com/dynamic/SymDir/otherlisted.txt",
        "https://www.emcorgroup.com/"
      ]
    }
  ],
  "logos": [
    {
      "url": "https://financialmodelingprep.com/image-stock/EME.png",
      "source": "fmp-public-image",
      "status": "verified",
      "checkedAt": "2026-10-17",
      "referenceUrl": "https://www.emcorgroup.com/",
      "redistribution": "not-granted",
      "sha256": "32a39055bd0ddca410b13248d7a912c8f202090aaf9acab10a6c5ba7e7968e21",
      "width": 128,
      "height": 76,
      "format": "png",
      "notes": "Striped teal diamond compared with the official issuer favicon; provider includes the EMCOR wordmark."
    }
  ]
}
