{
  "id": "expeditors-international",
  "name": "Expeditors International of Washington, Inc.",
  "reviewedAt": "2026-10-17",
  "identityEvidenceUrls": [
    "https://www.nasdaqtrader.com/dynamic/SymDir/otherlisted.txt",
    "https://www.expeditors.com/"
  ],
  "websiteUrl": "https://www.expeditors.com/",
  "securities": [
    {
      "market": "US",
      "symbol": "EXPD",
      "exchange": "NYSE",
      "kind": "common",
      "evidenceUrls": [
        "https://www.nasdaqtrader.com/dynamic/SymDir/otherlisted.txt",
        "https://www.expeditors.com/"
      ]
    }
  ],
  "logos": [
    {
      "url": "https://financialmodelingprep.com/image-stock/EXPD.png",
      "source": "fmp-public-image",
      "status": "verified",
      "checkedAt": "2026-10-17",
      "referenceUrl": "https://www.expeditors.com/",
      "redistribution": "not-granted",
      "sha256": "1d2beb21c25c577313063ca51a27306b025b26d01a119e76697bf3b4915a2e4e",
      "width": 250,
      "height": 250,
      "format": "png",
      "notes": "Orange/red angled device compared with the official issuer favicon."
    }
  ]
}
