{
  "id": "apogee-acquisition",
  "name": "Apogee Acquisition Corp",
  "reviewedAt": "2026-10-14",
  "identityEvidenceUrls": [
    "https://www.sec.gov/Archives/edgar/data/2102123/000121390026060608/ea0291860-8k_apogee.htm"
  ],
  "securities": [
    {
      "market": "US",
      "symbol": "AACP",
      "exchange": "NASDAQ",
      "kind": "common",
      "evidenceUrls": [
        "https://www.sec.gov/Archives/edgar/data/2102123/000121390026060608/ea0291860-8k_apogee.htm"
      ]
    },
    {
      "market": "US",
      "symbol": "AACPU",
      "exchange": "NASDAQ",
      "kind": "unit",
      "evidenceUrls": [
        "https://www.sec.gov/Archives/edgar/data/2102123/000121390026060608/ea0291860-8k_apogee.htm"
      ]
    },
    {
      "market": "US",
      "symbol": "AACPR",
      "exchange": "NASDAQ",
      "kind": "right",
      "evidenceUrls": [
        "https://www.sec.gov/Archives/edgar/data/2102123/000121390026060608/ea0291860-8k_apogee.htm"
      ]
    },
    {
      "market": "US",
      "symbol": "AACPW",
      "exchange": "NASDAQ",
      "kind": "warrant",
      "evidenceUrls": [
        "https://www.sec.gov/Archives/edgar/data/2102123/000121390026060608/ea0291860-8k_apogee.htm"
      ]
    }
  ],
  "logos": [
    {
      "url": "https://financialmodelingprep.com/image-stock/AACP.png",
      "source": "fmp-public-image",
      "status": "candidate",
      "checkedAt": "2026-10-14",
      "referenceUrl": "https://www.sec.gov/Archives/edgar/data/2102123/000121390026060608/ea0291860-8k_apogee.htm",
      "redistribution": "not-granted",
      "sha256": "6da1cb8052c7f1036779e1f6c00e80166cc8180453be0ebd3b229c34e0f0afec",
      "width": 100,
      "height": 100,
      "format": "png",
      "notes": "Blue A mark is available, but no issuer-specific brand reference was verified. Do not treat this monogram as an approved company logo."
    }
  ],
  "cik": "0002102123"
}
